{
  "name": "my-heycc-plugin",
  "version": "0.1.0",
  "description": "A minimal HeyCC plugin template.",
  "author": {
    "name": "Plugin Author"
  },
  "category": "productivity",
  "icon": "puzzlepiece.extension",
  "defaultEnabled": false,
  "requiredPermissions": [],
  "contributes": {
    "skills": [],
    "tools": [],
    "quickActions": [],
    "backgroundTasks": []
  }
}
